{
  "brand": "RUMBLING STONE · IL PORTALE DELLA FORGIA ETERNA",
  "title": "L'Ultima Porta",
  "subtitle": "Il cammino fin qui · e ciò che vi aspetta oltre la soglia",
  "banner": "PER IL GRUPPO",
  "meta": "Per i Custodi Eterni — da leggere prima della sessione di domani · nessuno spoiler: solo ciò che avete vissuto e un assaggio di ciò che verrà · i vostri momenti personali sono negli hint che ricevete a parte",
  "header": "Copertina + «il cammino fin qui» in un unico foglio da inviare al gruppo. Nessun materiale del DM: si condivide così com'è.",
  "footer": "L'Ultima Porta",
  "player_footer": "L'Ultima Porta",
  "cover_tag": "player",
  "cover_image": "../../Immagini/web/Piano Terra - Caverne Cristallo con Geodi Giganti (Parte 4).jpg",
  "intro_md": "06-TEASER-GIOCATORI.md",
  "out": "ARC07-GRUPPO-CAMMINO.html",
  "chapters": [],
  "fregio": "../../../docs/assets/fregi/fregio-arco-07-forgia.svg"
}
